,job_name,company,location,salary,skills_req,link
246,Customer Service Advisor,Tech Mahindra,"Noida, Ghaziabad, Delhi / NCR","2,00,000 - 2,25,000 PA.","BPO, customer service, voice, hindi, calling, Domestic Calling, communication skills",https://www.naukri.com/job-listings-customer-service-advisor-tech-mahindra-ltd-noida-ghaziabad-delhi-ncr-0-to-3-years-050322002878?src=jobsearchDesk&sid=16470883145074883&xp=8&px=13
247,Customer Service Executive,Tech Mahindra,"Noida, Ghaziabad, Delhi / NCR","1,50,000 - 1,75,000 PA.","BPO, customer service, voice, hiring, international voice process, calling, communication skills",https://www.naukri.com/job-listings-customer-service-executive-tech-mahindra-ltd-noida-ghaziabad-delhi-ncr-0-to-2-years-050322002486?src=jobsearchDesk&sid=16470883145074883&xp=9&px=13
248,Tech Mahindra is hiring a Customer Service Associate,Tech Mahindra,Pune,"1,75,000 - 2,00,000 PA.","BPO, customer service, voice, hindi, Domestic BPO, Voice Process, Voice Support",https://www.naukri.com/job-listings-tech-mahindra-is-hiring-a-customer-service-associate-tech-mahindra-ltd-pune-0-to-5-years-040222001369?src=jobsearchDesk&sid=16470883145074883&xp=10&px=13
249,Mega Walk In For Female Freshers in UP & Bihar on Sunday 13 Mar,Muthoot Finance,"Allahabad/Prayagraj, Varanasi/Benaras, Faizabad, Robertsganj, Gopiganj UP","1,50,000 - 2,50,000 PA.","business generation, outbound marketing, cce, customer communication, gold loan, customer care, cross selling, customer handling",https://www.naukri.com/job-listings-mega-walk-in-for-female-freshers-in-up-bihar-on-sunday-13-mar-muthoot-finance-ltd-allahabad-prayagraj-varanasi-benaras-faizabad-robertsganj-gopiganj-up-0-to-3-years-120322000208?src=jobsearchDesk&sid=16470883145074883&xp=11&px=13
250,Walk-in : Hiring For Relationship Officer @ Delhi/NCR,Axis Bank,Delhi / NCR,Not disclosed,"Loans, Direct Sales, Personal Loans, Housing Finance, Field Sales Executive, dhfl, Home Loans, hdb",https://www.naukri.com/job-listings-walk-in-hiring-for-relationship-officer-delhi-ncr-axis-bank-limited-delhi-ncr-0-to-5-years-110322006865?src=jobsearchDesk&sid=16470883145074883&xp=12&px=13
251,Walk-In-Drive For Sales Executive @ Axis Bank Indore,Axis Bank,Indore,"1,75,000 - 3,75,000 PA.","sales executive activities, Field Sales, Insurance, Casa Sales, Banking Sales",https://www.naukri.com/job-listings-walk-in-drive-for-sales-executive-axis-bank-indore-axis-bank-limited-indore-0-to-2-years-110322005189?src=jobsearchDesk&sid=16470883145074883&xp=13&px=13
252,Walk In Drive For Sales Officer Home Loan @ Gujarat,AU Small Finance Bank,"Bharuch, Vapi, Rajkot, Surat, Naroda",Not disclosed,"Loans, HL, Home Loans, Personal Loans, Housing, sales, Retail Assets, Housing Loan",https://www.naukri.com/job-listings-walk-in-drive-for-sales-officer-home-loan-gujarat-au-small-finance-bank-limited-bharuch-vapi-rajkot-surat-naroda-0-to-5-years-110322004666?src=jobsearchDesk&sid=16470883145074883&xp=14&px=13
253,MEGA WALK IN Drive ON 13 March (Sunday) I Muthoot Finance Limited I,Muthoot Finance,Guwahati,Not disclosed,"Sales, Operations",https://www.naukri.com/job-listings-mega-walk-in-drive-on-13-march-sunday-i-muthoot-finance-limited-i-muthoot-finance-ltd-guwahati-0-to-1-years-110322002899?src=jobsearchDesk&sid=16470883145074883&xp=15&px=13
254,MEGA WALK IN Drive ON 13TH March (Sunday) I Muthoot Finance Limited I,Muthoot Finance,Guwahati,Not disclosed,"Sales, Operations",https://www.naukri.com/job-listings-mega-walk-in-drive-on-13th-march-sunday-i-muthoot-finance-limited-i-muthoot-finance-ltd-guwahati-0-to-2-years-110322002728?src=jobsearchDesk&sid=16470883145074883&xp=16&px=13
255,Guest Service Associate F&B ( Coffee Specialist for Barista),Marriott,Lucknow,Not disclosed,"Supervisor, Printing, Usage, Safety training, Inspection, Management, Guest Service Associate, MAR",https://www.naukri.com/job-listings-guest-service-associate-f-b-coffee-specialist-for-barista-marriott-lucknow-0-to-3-years-100322501321?src=jobsearchDesk&sid=16470883145074883&xp=17&px=13
256,Axis Bank_ Walk in Interview_ Partner's Payroll_ Ahmedabad,Axis Bank,"Gandhinagar, Sanand, Ahmedabad",Not disclosed,"HL, Mortgage, Field Sales, Finance, Banking, Financial Products, Cold Calling, Lap",https://www.naukri.com/job-listings-axis-bank-walk-in-interview-partner-s-payroll-ahmedabad-axis-bank-limited-gandhinagar-sanand-ahmedabad-0-to-5-years-100322008743?src=jobsearchDesk&sid=16470883145074883&xp=18&px=13
257,Lenskart || Customer Service || Blended Process,Lenskart,"Noida, New Delhi(Mohan Co-operative)","50,000 - 3,00,000 PA.","chat, customer service, non voice, escalations, customer satisfaction, written communication, calling, customer care",https://www.naukri.com/job-listings-lenskart-customer-service-blended-process-lenskart-solutions-private-limited-noida-new-delhi-0-to-4-years-100322006725?src=jobsearchDesk&sid=16470883145074883&xp=19&px=13
258,HCL-Walk in - Chartered Accountant freshers,HCL,Pune,"2,50,000 - 6,00,000 PA.","Inter, Chartered accountant, Taxation, Ca, Auditing",https://www.naukri.com/job-listings-hcl-walk-in-chartered-accountant-freshers-hcl-technologies-limited-pune-0-to-2-years-100322004441?src=jobsearchDesk&sid=16470883145074883&xp=20&px=13
259,Axis Bank - Sales role-Walk in on 14th & 15 March - Panampally Nagar,Axis Bank,Kochi/Cochin,Not disclosed,"Casa, Sales, Field Sales, Selling, Lead Generation, Banking, Third Party Products, New Business",https://www.naukri.com/job-listings-axis-bank-sales-role-walk-in-on-14th-15-march-panampally-nagar-axis-bank-limited-kochi-cochin-0-to-3-years-100322001835?src=jobsearchDesk&sid=16470883348589762&xp=1&px=14
260,Customer Service Executive,Teleperformance,Kolkata,"1,25,000 - 2,50,000 PA.","BPO, hindi, Customer Relationship, Customer Support, customer service, Customer Satisfaction",https://www.naukri.com/job-listings-customer-service-executive-teleperformance-global-services-pvt-ltd-kolkata-0-to-5-years-080322008820?src=jobsearchDesk&sid=16470883348589762&xp=2&px=14
261,Walk-in Interviews For International Voice/Non Voice Process,Teleperformance,"Mohali/SAS Nagar, Chandigarh",Not disclosed,"BPO, voice, non voice, non voice process, international process, spoken english, chat, international voice",https://www.naukri.com/job-listings-walk-in-interviews-for-international-voice-non-voice-process-teleperformance-global-services-pvt-ltd-mohali-sas-nagar-chandigarh-0-to-3-years-040322007538?src=jobsearchDesk&sid=16470883348589762&xp=3&px=14
262,"Amazon is hiring For Customer Service Associate, Voice",Amazon,Rajasthan,"2,00,000 - 2,50,000 PA.","conflict resolution, customer service, BPO, voice, computer, web services, internet explorer, time management",https://www.naukri.com/job-listings-amazon-is-hiring-for-customer-service-associate-voice-amazon-development-centre-india-pvt-ltd-rajasthan-0-to-5-years-190222002742?src=jobsearchDesk&sid=16470883348589762&xp=4&px=14
263,"Amazon is hiring For Customer Service Associate, Voice",Amazon,"Haryana, Punjab","50,000 - 2,50,000 PA.","conflict resolution, customer service, BPO, voice, computer, web services, internet explorer, time management",https://www.naukri.com/job-listings-amazon-is-hiring-for-customer-service-associate-voice-amazon-development-centre-india-pvt-ltd-haryana-punjab-0-to-5-years-190222002717?src=jobsearchDesk&sid=16470883348589762&xp=5&px=14
264,"Amazon is hiring For Customer Service Associate, Voice",Amazon,Uttar Pradesh,"50,000 - 2,50,000 PA.","conflict resolution, computer, customer service, BPO, voice, web services, internet explorer, time management",https://www.naukri.com/job-listings-amazon-is-hiring-for-customer-service-associate-voice-amazon-development-centre-india-pvt-ltd-uttar-pradesh-0-to-5-years-160222004601?src=jobsearchDesk&sid=16470883348589762&xp=6&px=14
265,Civil Engineer,GR International,Chennai,"2,75,000 - 5,50,000 PA.","Design, Project Management, Site Layout, Civil Engineering, Construction Projects, Safe, Autocad Civil 3D, Technical Specifications",https://www.naukri.com/job-listings-civil-engineer-gr-international-chennai-0-to-3-years-110322610814?src=jobsearchDesk&sid=16470883348589762&xp=7&px=14
266,Technical Support Engineer ( Voice Process).,DXC Technology,"Noida, Chennai, Bangalore/Bengaluru",Not disclosed,"Copyright, Communication Skills, Hardware Networking, Database Handling, Technical Support, Calling, Corrective Action, Voice Process",https://www.naukri.com/job-listings-technical-support-engineer-voice-process-dxc-technology-india-private-limited-noida-chennai-bangalore-bengaluru-0-to-3-years-291121903627?src=jobsearchDesk&sid=16470883348589762&xp=8&px=14
267,Opening For International Voice process - Telecom,Prodapt Solutions Private Limited,"Chennai, Bangalore/Bengaluru",Not disclosed,"BPO, customer service, voice, inbound, troubleshooting, Customer Support, Order Management, Solving Queries",https://www.naukri.com/job-listings-opening-for-international-voice-process-telecom-prodapt-solutions-private-limited-chennai-bangalore-bengaluru-0-to-3-years-201221006133?src=jobsearchDesk&sid=16470883348589762&xp=9&px=14
268,L1 Support Position,IVY Mobility,"Chennai, Bangalore/Bengaluru",Not disclosed,"BPO, hindi, Customer Support, L1, SQL",https://www.naukri.com/job-listings-l1-support-position-ivy-mobility-solutions-ltd-chennai-bangalore-bengaluru-0-to-3-years-180222003937?src=jobsearchDesk&sid=16470883348589762&xp=10&px=14
269,Wipro Hiring For International Process,Wipro,Chennai,Not disclosed,"Order Management, Non Voice Process, International Process, International non voice process",https://www.naukri.com/job-listings-wipro-hiring-for-international-process-wipro-limited-chennai-0-to-3-years-180122003619?src=jobsearchDesk&sid=16470883348589762&xp=11&px=14
270,Application Support Engineer-Chennai/Bangalore-Immediate Requirement,Brainotix Solutions Pvt Ltd,"Chennai, Bangalore/Bengaluru",Not disclosed,"Java, SQL, communication, IT Skills, application support",https://www.naukri.com/job-listings-application-support-engineer-chennai-bangalore-immediate-requirement-brainotix-solutions-pvt-ltd-chennai-bangalore-bengaluru-0-to-2-years-120322000735?src=jobsearchDesk&sid=16470883348589762&xp=12&px=14
271,Job openings For Domestic customer support executive For F&B client,Riemen Solution Private Limited,Chennai,"1,50,000 - 2,00,000 PA.","Customer Support, Partner Support, BPO, customer service, inbound, outbound, hindi",https://www.naukri.com/job-listings-openings-for-domestic-customer-support-executive-for-f-b-client-riemen-solution-private-limited-chennai-0-to-2-years-120322000014?src=jobsearchDesk&sid=16470883348589762&xp=13&px=14
272,Technical Support Engineer (Voice),DXC Technology,"Noida, Chennai, Bangalore/Bengaluru",Not disclosed,"CBSE, ICSE, communication skills, communication, spoken communication, written, copyright, technical support",https://www.naukri.com/job-listings-technical-support-engineer-voice-dxc-technology-india-private-limited-noida-chennai-bangalore-bengaluru-0-to-3-years-080322601647?src=jobsearchDesk&sid=16470883348589762&xp=14&px=14
273,Direct Walk-In Interview| Freshers | Nungambakkam,VIZZA insurance broking services pvt ltd,Chennai(Choolaima Nagar +14),Not disclosed,"BPO, Life Insurance, Insurance Sales, Telecalling, Domestic BPO, Voice Process, Outbound Process, Health Insurance",https://www.naukri.com/job-listings-direct-walk-in-interview-freshers-nungambakkam-vizza-insurance-broking-services-pvt-ltd-chennai-0-to-2-years-080322005293?src=jobsearchDesk&sid=16470883348589762&xp=15&px=14
274,Technical Support Engineer (Voice),DXC Technology,"Noida, Chennai, Bangalore/Bengaluru",Not disclosed,"CBSE, ICSE, communication skills, written, communication, spoken communication, copyright, technical support",https://www.naukri.com/job-listings-technical-support-engineer-voice-dxc-technology-india-private-limited-noida-chennai-bangalore-bengaluru-0-to-3-years-080322001645?src=jobsearchDesk&sid=16470883348589762&xp=16&px=14
275,Customer Service Associate,Freightos,Chennai,Not disclosed,"Product management, Supply chain, Data management, Project management, Air freight, Customer service, Management, Customer Service Associate",https://www.naukri.com/job-listings-customer-service-associate-freightos-chennai-0-to-2-years-300721500301?src=jobsearchDesk&sid=16470883348589762&xp=17&px=14
276,Customer Support Executive- Voice Process,Navia Markets Ltd.,Chennai(Nungambakkam),"1,50,000 - 2,75,000 PA.","BPO, Customer Service, Mutual Funds, hindi voice, inbound, Solving Queries, Calling, Voice Process",https://www.naukri.com/job-listings-customer-support-executive-voice-process-navia-markets-ltd-chennai-0-to-5-years-250222010480?src=jobsearchDesk&sid=16470883348589762&xp=18&px=14
277,Hiring Asp.Net / Mvc.Net Developer For IT,Allsec Technologies Limited,Chennai,"2,00,000 - 3,00,000 PA.","c#, .net, ajax, IT Skills, Software Development, Oracle, ASP.Net, web services",https://www.naukri.com/job-listings-hiring-asp-net-mvc-net-developer-for-it-allsec-technologies-limited-chennai-0-to-1-years-120322000895?src=jobsearchDesk&sid=16470883348589762&xp=19&px=14
278,Customer Experience Associates,Yespired,Chennai,Not disclosed,"Excel, analytical skills, communication skills, Customer Service, Customer Support, Client Service, learning management system",https://www.naukri.com/job-listings-customer-experience-associates-yespired-chennai-0-to-5-years-110322904282?src=jobsearchDesk&sid=16470883348589762&xp=20&px=14
279,Customer Relationship Executive,Evodigital Technologies Private Limited,Chennai,"2,25,000 - 2,50,000 PA.","Customer Relationship, Customer Care, customer support, Customer Service",https://www.naukri.com/job-listings-customer-relationship-executive-evodigital-technologies-private-limited-chennai-0-to-2-years-110322007874?src=jobsearchDesk&sid=16470883554236623&xp=1&px=15
280,Customer Care Executive,Medall Healthcare Pvt Ltd,Chennai,Not disclosed,"BPO, inbound, Communication Skills, inbound calls, customer care, customer handling",https://www.naukri.com/job-listings-customer-care-executive-medall-healthcare-pvt-ltd-chennai-0-to-2-years-100322010308?src=jobsearchDesk&sid=16470883554236623&xp=2&px=15
281,Customer Care Executive (Fresher),Allsec Technologies Limited,"Noida, Chennai, Bangalore/Bengaluru",Not disclosed,"customer service, Communication, written communication, Day Shift, Customer Care Executive, Kannada, Fresher, Hindi",https://www.naukri.com/job-listings-customer-care-executive-fresher-allsec-technologies-limited-noida-chennai-bangalore-bengaluru-0-to-1-years-090921502244?src=jobsearchDesk&sid=16470883554236623&xp=3&px=15
282,Kannada Voice Process - Presales Department,Casa Grand Builder Private Limited,"Chennai, Bangalore/Bengaluru","2,00,000 - 3,00,000 PA.","English, Telesales, Telecalling, Voice Process",https://www.naukri.com/job-listings-kannada-voice-process-presales-department-casa-grand-builder-private-limited-chennai-bangalore-bengaluru-0-to-2-years-070222007711?src=jobsearchDesk&sid=16470883554236623&xp=4&px=15
283,Customer Relationship Officer - Voice Process - (English Mandatory).,BankBazaar.com,Chennai,"1,75,000 - 2,50,000 PA.","Interpersonal Communication, Telecalling, Customer Handling, Customer Relationship, Voice Process",https://www.naukri.com/job-listings-customer-relationship-officer-voice-process-english-mandatory-bankbazaar-com-chennai-0-to-5-years-020322007131?src=jobsearchDesk&sid=16470883554236623&xp=5&px=15
284,Customer Service - Sales - Housing - EM - Sales,TATA CAPITAL LTD,Chennai,Not disclosed,"Compliance, Customer satisfaction, CRE, Service sales, Customer service, Vendor, Sales promotion, Auditing",https://www.naukri.com/job-listings-customer-service-sales-housing-em-sales-tata-capital-ltd-chennai-0-to-4-years-310122500316?src=jobsearchDesk&sid=16470883554236623&xp=6&px=15
285,Backend Operation (Non voice)- Chennai,Trigent,Chennai,Not disclosed,"night shift, insurance claims, backend, non voice",https://www.naukri.com/job-listings-backend-operation-non-voice-chennai-trigent-software-limited-chennai-0-to-0-years-291118600107?src=jobsearchDesk&sid=16470883554236623&xp=7&px=15
286,Jio Mart Hiring - HDE / KAE HoReCa & Institutions -B2B Grocery / FMCG,Reliance Retail,"Kochi/Cochin, Madurai, Pondicherry/Puducherry, Thrissur/Trichur, Salem, Chennai, Coimbatore, Trivandrum/Thiruvananthapuram, Erode","2,50,000 - 5,00,000 PA.","horeca, Customer Service, B2B, Sales, grocery, Institutional Sales, fmcg, B2B Sales",https://www.naukri.com/job-listings-jio-mart-hiring-hde-kae-horeca-institutions-b2b-grocery-fmcg-reliance-retail-kochi-cochin-madurai-pondicherry-puducherry-thrissur-trichur-salem-chennai-coimbatore-trivandrum-thiruvananthapuram-erode-0-to-5-years-260222004333?src=jobsearchDesk&sid=16470883554236623&xp=8&px=15
287,Walk-In Interviews - Btech/Mtech Fresher - Java or Python,SMARTIT FRAME SOFTWARE SERVICES PRIVATE LIMITED,Chennai,"50,000 - 1,75,000 PA.","python, java, IT Skills",https://www.naukri.com/job-listings-walk-in-interviews-btech-mtech-fresher-java-or-python-smartit-frame-software-services-private-limited-chennai-0-to-1-years-260222003643?src=jobsearchDesk&sid=16470883554236623&xp=9&px=15
288,Customer Service Executive,Trayee Business Solutions P Ltd.,Chennai,Not disclosed,"Analytical skills, Banking, Customer service, Business solutions, Customer Service Executive",https://www.naukri.com/job-listings-customer-service-executive-trayee-business-solutions-p-ltd-chennai-0-to-1-years-250419500914?src=jobsearchDesk&sid=16470883554236623&xp=10&px=15
289,Walk-In For Java Freshers / Work Location - Madurai,Chain-Sys,Chennai(Ayanambakkam +1),Not disclosed,"Java, IT Skills, C++, Advanced Java, core java",https://www.naukri.com/job-listings-walk-in-for-java-freshers-work-location-madurai-chain-sys-india-pvt-ltd-chennai-0-to-1-years-250222010619?src=jobsearchDesk&sid=16470883554236623&xp=11&px=15
290,customer service officer - japan desk,Formula Group,Chennai,Not disclosed,"Interpersonal skills, Sales operations, Customer service, Management, Japanese",https://www.naukri.com/job-listings-customer-service-officer-japan-desk-formula-group-chennai-0-to-4-years-250122500476?src=jobsearchDesk&sid=16470883554236623&xp=12&px=15
291,Customer Service - Sales - Housing - DM - HL - Sales,TATA CAPITAL LTD,Chennai,Not disclosed,"Compliance, Customer satisfaction, CRE, Service sales, Customer service, Vendor, Sales promotion, Auditing",https://www.naukri.com/job-listings-customer-service-sales-housing-dm-hl-sales-tata-capital-ltd-chennai-0-to-4-years-230222500239?src=jobsearchDesk&sid=16470883554236623&xp=13&px=15
292,Airport Customer Service Agent,Smart group,"Nagercoil, Chennai, Coimbatore","3,00,000 - 4,00,000 PA.","Ground Staff Activities, Customer Service, Aviation, B.E Mechanical Engineering, Ground Handling, Airport Operation, Airport Ground Handling, Any Degree",https://www.naukri.com/job-listings-airport-customer-service-agent-smart-group-nagercoil-chennai-coimbatore-0-to-0-years-220222008191?src=jobsearchDesk&sid=16470883554236623&xp=14&px=15
293,New Associate-Customer service - Inbound,Accenture,Chennai,Not disclosed,"IT Skills, Cloud, Outbound, Master data management, Customer service management, Service desk, Consulting, Voice support",https://www.naukri.com/job-listings-new-associate-customer-service-inbound-accenture-solutions-pvt-ltd-chennai-0-to-1-years-210222905957?src=jobsearchDesk&sid=16470883554236623&xp=15&px=15
294,Customer Service Executive,MY INDIAN PEROPERTY,Chennai,Not disclosed,"Malayalam, Customer Care Executive, Customer Service Executive",https://www.naukri.com/job-listings-customer-service-executive-my-indian-peroperty-chennai-0-to-2-years-200421501246?src=jobsearchDesk&sid=16470883554236623&xp=16&px=15
295,Customer Service Executive,Edeal FX,Chennai,Not disclosed,"CFD, Business administration, Forex, Sales, financial products, Online trading, Customer service, MS Office",https://www.naukri.com/job-listings-customer-service-executive-edeal-fx-chennai-0-to-5-years-170320500133?src=jobsearchDesk&sid=16470883554236623&xp=17&px=15
296,Customer Service Executive,Smart Career Overseas,Chennai(Teynampet),"1,75,000 - 3,00,000 PA.","Customer Support, Good Communication In English, Client Servicing, Sales, Relationship Building, Business Development",https://www.naukri.com/job-listings-customer-service-executive-smart-career-overseas-chennai-0-to-5-years-140222009918?src=jobsearchDesk&sid=16470883554236623&xp=18&px=15
297,Back office Non Voice - Chennai,Trigent,Chennai,"1,00,000 - 1,25,000 PA.","BPO, voice, back office, Backend, Back Office Support, Non Voice",https://www.naukri.com/job-listings-back-office-non-voice-chennai-trigent-software-private-limited-chennai-0-to-0-years-100222609043?src=jobsearchDesk&sid=16470883554236623&xp=19&px=15
298,Back office Non Voice - Chennai,Trigent,Chennai,"1,00,000 - 1,25,000 PA.","BPO, voice, back office, Backend, Back Office Support, Non Voice",https://www.naukri.com/job-listings-back-office-non-voice-chennai-trigent-software-private-limited-chennai-0-to-0-years-100222009041?src=jobsearchDesk&sid=16470883554236623&xp=20&px=15
299,Customer Service Executive,Ascendum Kps Private Limited,Remote,"50,000 - 1,50,000 PA.","customer service, calling",https://www.naukri.com/job-listings-customer-service-executive-ascendum-kps-private-limited-chennai-0-to-5-years-100222003115?src=jobsearchDesk&sid=16470883744089110&xp=1&px=16
300,CUSTOMER SERVICE EXECUTIVE,DCB,Chennai,Not disclosed,"Retail, Sales, Networking, Compliance, Trade finance, Mutual funds, MIS, banking products",https://www.naukri.com/job-listings-customer-service-executive-dcb-bank-limited-chennai-0-to-2-years-090921500818?src=jobsearchDesk&sid=16470883744089110&xp=2&px=16
301,CUSTOMER SERVICE EXECUTIVE,DCB,Chennai,Not disclosed,"Sales, Networking, Compliance, MIS, Banking, banking products, Customer Service Executive, Auditing",https://www.naukri.com/job-listings-customer-service-executive-dcb-bank-limited-chennai-0-to-2-years-090921500808?src=jobsearchDesk&sid=16470883744089110&xp=3&px=16
302,Customer Service Executive,TRDFIN SUPPORT SERVICES PRIVATE LIMITED,Chennai(Mylapore),"80,000 - 2,50,000 PA.","BPO, customer service, Communication Skills, Presentation Skills, Effective Communication, Team Skills, Analytical Skills, Problem Solving",https://www.naukri.com/job-listings-customer-service-executive-trdfin-support-services-private-limited-chennai-0-to-5-years-090222006745?src=jobsearchDesk&sid=16470883744089110&xp=4&px=16
303,Job Fair For Fresher & Experience @ Matrimony - Guindy,Matrimony.com,Chennai,"1,50,000 - 2,75,000 PA.","BPO, voice, benefits, voice process, pf, bonus, gratuity, hr",https://www.naukri.com/job-listings-fair-for-fresher-experience-matrimony-guindy-matrimony-com-limited-chennai-0-to-4-years-040322005174?src=jobsearchDesk&sid=16470883744089110&xp=5&px=16
304,Medical Representative -Chennai Hq,Zuventus Healthcare Ltd,Chennai,Not disclosed,"Sales, Time Management, Healthcare, Field Work, Business Development, Management Skills, Pharmaceutical Sales",https://www.naukri.com/job-listings-medical-representative-chennai-hq-zuventus-healthcare-ltd-chennai-0-to-4-years-040322002732?src=jobsearchDesk&sid=16470883744089110&xp=6&px=16
305,Mega Walk In - Medical Coding Trained Freshers,Worldsource Healthcare India Pvt Ltd,Chennai,Not disclosed,"medical coding, human anatomy, physiology, cpt, interpersonal skills, icd",https://www.naukri.com/job-listings-mega-walk-in-medical-coding-trained-freshers-worldsource-healthcare-india-pvt-ltd-chennai-0-to-0-years-020322002720?src=jobsearchDesk&sid=16470883744089110&xp=7&px=16
306,Hindi Non Voice - Banking Process,Cameo Corporate Services Limited,Chennai(Mount Road),Not disclosed,"BPO, semi voice, hindi, banking process, Hindi Speaking",https://www.naukri.com/job-listings-hindi-non-voice-banking-process-cameo-corporate-services-limited-chennai-0-to-2-years-010322001396?src=jobsearchDesk&sid=16470883744089110&xp=8&px=16
307,Genpact is Hiring For Regional Language || Virtual Drive ON 14-March,Genpact,"Dadra & Nagar Haveli/Silvassa, Hyderabad/Secunderabad, Aizawl, Daman & Diu, Jaisalmer",Not disclosed,"BPO, customer service, non voice, mizo, facebook, meitei, customer care, problem solving",https://www.naukri.com/job-listings-genpact-is-hiring-for-regional-language-virtual-drive-on-14-march-genpact-india-private-limited-dadra-nagar-haveli-silvassa-hyderabad-secunderabad-aizawl-daman-diu-jaisalmer-0-to-5-years-110322003980?src=jobsearchDesk&sid=16470883744089110&xp=9&px=16
308,Genpact is Hiring For Bengali Language || Virtual Drive on 14-March,Genpact,"Kolkata, Singur, Hyderabad/Secunderabad",Not disclosed,"BPO, customer service, non voice, mizo, facebook, meitei, customer care, problem solving",https://www.naukri.com/job-listings-genpact-is-hiring-for-bengali-language-virtual-drive-on-14-march-genpact-india-private-limited-kolkata-singur-hyderabad-secunderabad-0-to-5-years-110322003963?src=jobsearchDesk&sid=16470883744089110&xp=10&px=16
309,Mega Virtual Drive For Non-Voice Process ( Regional Languages ),Genpact,Hyderabad/Secunderabad,Not disclosed,"BPO, customer service, non voice, Malayalam, Non Voice Process, Urdu, Marathi, Content Review",https://www.naukri.com/job-listings-mega-virtual-drive-for-non-voice-process-regional-languages-genpact-india-private-limited-hyderabad-secunderabad-0-to-5-years-280222003540?src=jobsearchDesk&sid=16470883744089110&xp=11&px=16
310,Selling Partner Support Associate - SPS IN(Work from Home) - Hyd(2022),Amazon,Hyderabad/Secunderabad,"3,00,000 - 4,00,000 PA.","Clearing, Email Support, Service Level, Customer Service, Inbound, MS Office, Operational Support, Outbound Calling",https://www.naukri.com/job-listings-selling-partner-support-associate-sps-in-work-from-home-hyd-2022-amazon-development-centre-india-pvt-ltd-hyderabad-secunderabad-0-to-5-years-251121001259?src=jobsearchDesk&sid=16470883744089110&xp=12&px=16
