,job_name,company,location,salary,skills_req,link
674,Walk-in Daily For Customer service profile Voice/Non voice,Globiva Services Private Limited,Gurgaon/Gurugram,"1,75,000 - 2,50,000 PA.","BPO, customer service, voice, non voice, calling, communication skills",https://www.naukri.com/job-listings-walk-in-daily-for-customer-service-profile-voice-non-voice-globiva-services-private-limited-gurgaon-gurugram-0-to-4-years-150222004040?src=jobsearchDesk&sid=16470887418408763&xp=18&px=34
675,Branch Operations Service Head | Private Bank,Next Business Services India Private Limited,"Noida, Ghaziabad, Faridabad, Gurgaon/Gurugram, Delhi / NCR","2,00,000 - 3,00,000 PA.","Clearing, Private Banking, Branch Operations, Banking Operations, Accounting, ms, Virtual Assistant, Research",https://www.naukri.com/job-listings-branch-operations-service-head-private-bank-next-business-services-india-private-limited-noida-ghaziabad-faridabad-gurgaon-gurugram-delhi-ncr-0-to-4-years-120322000299?src=jobsearchDesk&sid=16470887418408763&xp=19&px=34
676,Assistant Manager /Customer Support /backend| Leading Bank,Next Business Services India Private Limited,"Noida, Ghaziabad, Dehradun, Rudrapur, Meerut, Faridabad, Gurgaon/Gurugram, Delhi / NCR","2,25,000 - 3,75,000 PA.","Retail Banking, Customer Service, Retail Sales, Private Banking, Banking Operations, Banking, Admin Executive, Customer Support",https://www.naukri.com/job-listings-assistant-manager-customer-support-backend-leading-bank-next-business-services-india-private-limited-noida-ghaziabad-dehradun-rudrapur-meerut-faridabad-gurgaon-gurugram-delhi-ncr-0-to-4-years-120322000273?src=jobsearchDesk&sid=16470887626116823&xp=1&px=35
677,Customer Service - Sales - Housing - EM - HL - Sales,TATA CAPITAL LTD,Faridabad,Not disclosed,"Compliance, Customer satisfaction, CRE, Service sales, Customer service, Vendor, Sales promotion, SCO",https://www.naukri.com/job-listings-customer-service-sales-housing-em-hl-sales-tata-capital-ltd-faridabad-0-to-4-years-110322500603?src=jobsearchDesk&sid=16470887626116823&xp=2&px=35
678,Customer Service - Sales - Housing - EM - HL - Sales,TATA CAPITAL LTD,Agra,Not disclosed,"Compliance, Customer satisfaction, CRE, Service sales, Customer service, Vendor, Sales promotion, Auditing",https://www.naukri.com/job-listings-customer-service-sales-housing-em-hl-sales-tata-capital-ltd-agra-0-to-4-years-110322500602?src=jobsearchDesk&sid=16470887626116823&xp=3&px=35
679,Walk-in Interview | B. Tech/ Diploma Freshers,UKB Electronics Pvt. Ltd.,Noida,Not disclosed,"Diploma, Mechanical, Electronics, Fresher, Electrical, B. Tech",https://www.naukri.com/job-listings-walk-in-interview-b-tech-diploma-freshers-ukb-electronics-pvt-ltd-noida-0-to-0-years-100322007476?src=jobsearchDesk&sid=16470887626116823&xp=4&px=35
680,Domestic and International Voice Process,Teleperformance,Bangalore/Bengaluru,"1,25,000 - 2,50,000 PA.","BPO, customer service, voice, hindi, tamil, international voice process, english, communication skills",https://www.naukri.com/job-listings-domestic-and-international-voice-process-teleperformance-global-services-pvt-ltd-bangalore-bengaluru-0-to-3-years-090222000844?src=jobsearchDesk&sid=16470887626116823&xp=5&px=35
681,GSA-F&B Service,Marriott,Panaji/Panjim,Not disclosed,"Hospitality, Safety training, Management, LBS",https://www.naukri.com/job-listings-gsa-f-b-service-marriott-panaji-panjim-0-to-2-years-080322500999?src=jobsearchDesk&sid=16470887626116823&xp=6&px=35
682,Front Office Associate,Marriott,Bangalore/Bengaluru,Not disclosed,"Housekeeping, Supervisor, Station, Loss prevention, Front Office Associate, Manager Quality Assurance, Billing, Banking",https://www.naukri.com/job-listings-front-office-associate-marriott-bangalore-bengaluru-0-to-2-years-070322501299?src=jobsearchDesk&sid=16470887626116823&xp=7&px=35
683,100 Requirements For International BPO Voice Process,Intellecta Consultants,"Pune, Chennai, Mumbai (All Areas)","1,50,000 - 6,50,000 PA.","BPO, inbound, outbound, Blended Process, Customer Service, International Call Center, Webchat, Voice Process",https://www.naukri.com/job-listings-100-requirements-for-international-bpo-voice-process-intellecta-consultants-pune-chennai-mumbai-all-areas-0-to-5-years-051021002820?src=jobsearchDesk&sid=16470887626116823&xp=8&px=35
684,Hiring For BPO Voice Process,Allsec Technologies Limited,Bangalore/Bengaluru,"1,25,000 - 2,00,000 PA.","voice process, bpo voice, customer care, BPO, voice, incentives, hiring, calling",https://www.naukri.com/job-listings-hiring-for-bpo-voice-process-allsec-technologies-limited-bangalore-bengaluru-0-to-1-years-050322001607?src=jobsearchDesk&sid=16470887626116823&xp=9&px=35
685,customer Care executive,Allsec Technologies Limited,Bangalore/Bengaluru,"1,25,000 - 2,00,000 PA.","BPO, voice, voice process, bpo voice, customer care",https://www.naukri.com/job-listings-customer-care-executive-allsec-technologies-limited-bangalore-bengaluru-0-to-1-years-040322002045?src=jobsearchDesk&sid=16470887626116823&xp=10&px=35
686,Walk In For Freshers in Muthoot Finance Ltd (Viramgam & Himmatnagar),Muthoot Finance,"Viramgam, Himatnagar","1,50,000 - 1,75,000 PA.","Financial Services, Cross Selling, Accounting, Finance, Banking, Business Development",https://www.naukri.com/job-listings-walk-in-for-freshers-in-muthoot-finance-ltd-viramgam-himmatnagar-muthoot-finance-ltd-viramgam-himatnagar-0-to-2-years-210222010453?src=jobsearchDesk&sid=16470887626116823&xp=11&px=35
687,Associate - Customer Service,Career Infosystem,"Ludhiana, Punjab",Not disclosed,"Customer Service, customer retention, customer support, communication skills",https://www.naukri.com/job-listings-associate-customer-service-career-infosystem-ludhiana-punjab-0-to-2-years-130721905320?src=jobsearchDesk&sid=16470887626116823&xp=12&px=35
688,Lenskart || Customer Service || Non Voice,Lenskart,"Noida, New Delhi(Mohan Co-operative)","50,000 - 3,00,000 PA.","chat, customer service, non voice, escalations, customer satisfaction, written communication, calling, customer care",https://www.naukri.com/job-listings-lenskart-customer-service-non-voice-lenskart-solutions-private-limited-noida-new-delhi-0-to-4-years-100222001070?src=jobsearchDesk&sid=16470887626116823&xp=13&px=35
689,Guest Service Associate-Housekeeping,Marriott,Mysore/Mysuru,Not disclosed,"Housekeeping, Appliances, Safety training, Room service, Management, Guest Service Associate, LBS",https://www.naukri.com/job-listings-guest-service-associate-housekeeping-marriott-mysore-mysuru-0-to-2-years-070322501361?src=jobsearchDesk&sid=16470887626116823&xp=14&px=35
690,Guest Service Associate - Front Office,Marriott,Kolkata,Not disclosed,"Housekeeping, Supervisor, Training, Station, Loss prevention, Front office, Manager Quality Assurance, Billing",https://www.naukri.com/job-listings-guest-service-associate-front-office-marriott-kolkata-0-to-2-years-070322501305?src=jobsearchDesk&sid=16470887626116823&xp=15&px=35
691,GSA - F&B Service,Marriott,Chandigarh,Not disclosed,"Hospitality, Safety training, Management, LBS",https://www.naukri.com/job-listings-gsa-f-b-service-marriott-chandigarh-0-to-2-years-070322501301?src=jobsearchDesk&sid=16470887626116823&xp=16&px=35
692,F&B Service Associate,Marriott,Ahmedabad,Not disclosed,"Hospitality, Safety training, Service Associate, Weaving, Management, LBS",https://www.naukri.com/job-listings-f-b-service-associate-marriott-ahmedabad-0-to-2-years-070322501290?src=jobsearchDesk&sid=16470887626116823&xp=17&px=35
693,Service Officer,Kotak Mahindra,"Mehsana, Bhuj, Kadi, Rajkot","2,00,000 - 2,50,000 PA.","Customer Service, Solving Queries, Customer Handling",https://www.naukri.com/job-listings-service-officer-kotak-mahindra-bank-limited-mehsana-bhuj-kadi-rajkot-0-to-3-years-070322000339?src=jobsearchDesk&sid=16470887626116823&xp=18&px=35
694,Customer Service Executive,PolicyBazaar,Gurgaon/Gurugram,"1,75,000 - 3,00,000 PA.","customer service, outbound calling",https://www.naukri.com/job-listings-customer-service-executive-policybazaar-insurance-brokers-pvt-ltd-gurgaon-gurugram-0-to-5-years-040322003446?src=jobsearchDesk&sid=16470887626116823&xp=19&px=35
695,Urgent requirement For Manager/Sr. Manager Forecasting,Genpact,"Mumbai, Hyderabad/Secunderabad, Pune, Gurgaon/Gurugram, Chennai, Bangalore/Bengaluru",Not disclosed,"python, r, data analytics, time series, model building, forecasting models, machine learning, insight generation",https://www.naukri.com/job-listings-urgent-requirement-for-manager-sr-manager-forecasting-genpact-india-private-limited-mumbai-hyderabad-secunderabad-pune-gurgaon-gurugram-chennai-bangalore-bengaluru-4-to-9-years-080322001760?src=jobsearchDesk&sid=16470887626116823&xp=20&px=35
696,Trainee,IGT Solutions,"Pune, Gurgaon/Gurugram, Chennai",Not disclosed,communication skills,https://www.naukri.com/job-listings-trainee-igt-solutions-private-limited-pune-gurgaon-gurugram-chennai-0-to-1-years-240222003146?src=jobsearchDesk&sid=16470887823698630&xp=1&px=36
697,Mechanical Engineer Fresher Trainee,GR International,Chennai,Not disclosed,"CFD, Design, Fluid Dynamics, FEA, AutoCAD, Computational Fluid Dynamics, Solution Designing, Ansys",https://www.naukri.com/job-listings-mechanical-engineer-fresher-trainee-gr-international-chennai-0-to-3-years-100222601159?src=jobsearchDesk&sid=16470887823698630&xp=2&px=36
698,Fresher Engineer Diploma/Graduate Trainee,GR International,Chennai,"1,75,000 - 2,75,000 PA.","Engineer, Solution Designing, US Accounting, Automotive Testing, Working Capital Management, HR and Recruitment and IR",https://www.naukri.com/job-listings-fresher-engineer-diploma-graduate-trainee-gr-international-chennai-0-to-2-years-060222601483?src=jobsearchDesk&sid=16470887823698630&xp=3&px=36
699,Hiring For International Voice process- Hyderabad location(WFH),Tech Mahindra,"Kolkata, New Delhi, Hyderabad/Secunderabad, Pune, Chennai, Bangalore/Bengaluru, Delhi / NCR, Mumbai (All Areas)","3,00,000 - 4,25,000 PA.","Communication Skills, Voice Process, International Voice Process, BPO, voice, inbound, Customer Service, International Call Center",https://www.naukri.com/job-listings-hiring-for-international-voice-process-hyderabad-location-wfh-tech-mahindra-ltd-kolkata-new-delhi-hyderabad-secunderabad-pune-chennai-bangalore-bengaluru-delhi-ncr-mumbai-all-areas-1-to-6-years-220122000631?src=jobsearchDesk&sid=16470887823698630&xp=4&px=36
700,International Voice Process- WFH,Tech Mahindra,"Kolkata, Hyderabad/Secunderabad, Pune, Ahmedabad, Chennai, Bangalore/Bengaluru, Mumbai (All Areas)","3,00,000 - 4,25,000 PA.","BPO, voice, inbound, Customer Service, inbound calls, international voice process, US Shift, Technical Support",https://www.naukri.com/job-listings-international-voice-process-wfh-tech-mahindra-ltd-kolkata-hyderabad-secunderabad-pune-ahmedabad-chennai-bangalore-bengaluru-mumbai-all-areas-1-to-6-years-020322009654?src=jobsearchDesk&sid=16470887823698630&xp=5&px=36
701,Opening For Non Voice For Chennai (WORK FROM Office),Sutherland,Chennai(Perungalathur),"1,50,000 - 2,00,000 PA.","BPO, non voice, Customer Service, International Call Center, Anglo indian, Solving Queries, Client Satisfaction, Excellent communication",https://www.naukri.com/job-listings-opening-for-non-voice-for-chennai-work-from-office-sutherland-global-services-private-limited-chennai-0-to-0-years-160721004336?src=jobsearchDesk&sid=16470887823698630&xp=6&px=36
702,"Top mnc hiring freshers For domestic process, sal 14k+inc, Call imm",Ignites Human Capital Services Pvt Ltd.,Chennai,"3,00,000 - 4,50,000 PA.","BPO, customer service, voice, Inbound Process, international bpo, International Call Center, ISP, Telecommunication",https://www.naukri.com/job-listings-top-mnc-hiring-freshers-for-domestic-process-sal-14k-inc-call-imm-ignites-human-capital-services-pvt-ltd-chennai-0-to-5-years-120322000495?src=jobsearchDesk&sid=16470887823698630&xp=7&px=36
703,Sutherland IS Hiring For Tamil Voice Process,Sutherland,Chennai,Not disclosed,"BPO, voice, Customer Service, Customer Support, Domestic Voice Process, Customer Care",https://www.naukri.com/job-listings-sutherland-is-hiring-for-tamil-voice-process-sutherland-global-services-private-limited-chennai-0-to-1-years-280222008171?src=jobsearchDesk&sid=16470887823698630&xp=8&px=36
704,Hiring For Hindi Voice Process ! Day Shift,CAPTALENT HR,"Chennai, Bangalore/Bengaluru","1,25,000 - 1,75,000 PA.","BPO, hindi, BBA, MNC, hiring, freshers, 2021, hr",https://www.naukri.com/job-listings-hiring-for-hindi-voice-process-day-shift-captalent-hr-chennai-bangalore-bengaluru-0-to-2-years-240222001628?src=jobsearchDesk&sid=16470887823698630&xp=9&px=36
705,Customer Support Executives,ISPL Chennai,Chennai,Not disclosed,"BPO, voice, inbound, hindi, Voice process, Inbound process, Customer support, Customer relationship",https://www.naukri.com/job-listings-customer-support-executives-ispl-chennai-chennai-0-to-2-years-210518500279?src=jobsearchDesk&sid=16470887823698630&xp=10&px=36
706,BPO | Technical /Customer support (Voice) | Sal upto 3.5 LP.A,Oxilum Technologies,Chennai,"2,00,000 - 3,50,000 PA.","BPO, voice, non voice, Semi Voice, Calls, Voice Process, Inbound, UK Shift",https://www.naukri.com/job-listings-bpo-technical-customer-support-voice-sal-upto-3-5-lp-a-oxilum-technologies-chennai-0-to-4-years-170920005886?src=jobsearchDesk&sid=16470887823698630&xp=11&px=36
707,Customer Support/ Voice Process Executive - Hindi Mandatory,Amrutha Business Solutions,Chennai(Nungambakkam),Not disclosed,"Communication Skills, voice based process, Telesales, outbound process, outbound sales, inbound marketing, inbound sales, Sales Executive Activities",https://www.naukri.com/job-listings-customer-support-voice-process-executive-hindi-mandatory-amrutha-business-solutions-chennai-0-to-3-years-110322001208?src=jobsearchDesk&sid=16470887823698630&xp=12&px=36
708,Opening For Freshers,CMA CGM,Chennai,Not disclosed,"Export Documentation, Freight Forwarding, shipping, Non Voice Process, Import Documentation, Shipping Line, Logistics",https://www.naukri.com/job-listings-opening-for-freshers-cma-cgm-global-business-services-india-private-limited-chennai-0-to-1-years-100322010112?src=jobsearchDesk&sid=16470887823698630&xp=13&px=36
709,Accounts Executive,Royaloak Incorporation PVT LTD,Chennai,Not disclosed,"Accounting, Accounts executive, Accounts Payable",https://www.naukri.com/job-listings-accounts-executive-royaloak-incorporation-pvt-ltd-chennai-0-to-3-years-100322004879?src=jobsearchDesk&sid=16470887823698630&xp=14&px=36
710,Sal 11K Huge Openings For Non voice Night shift Immediate Joiners !!,Access Healthcare,Chennai,"1,00,000 - 1,75,000 PA.","BPO, non voice, night shift, Typing, Non Voice Process, US Shift, 2021, 2020",https://www.naukri.com/job-listings-sal-11k-huge-openings-for-non-voice-night-shift-immediate-joiners-access-healthcare-services-pvt-ltd-chennai-0-to-2-years-080322008320?src=jobsearchDesk&sid=16470887823698630&xp=15&px=36
711,Hiring For Senior Technical support associate ( voice ),Ignites Human Capital Services Pvt Ltd.,"Pune, Chennai, Bangalore/Bengaluru
(WFH during Covid)","2,75,000 - 4,50,000 PA.","BPO, voice, troubleshooting, Hardware Networking, Desktop Administration, Printer Support, Laptop Support, System Administration",https://www.naukri.com/job-listings-hiring-for-senior-technical-support-associate-voice-ignites-human-capital-services-pvt-ltd-pune-chennai-bangalore-bengaluru-0-to-5-years-050222005084?src=jobsearchDesk&sid=16470887823698630&xp=16&px=36
712,Spot Offer || 100+ Openings || Domestic BPO Voice Process,ARMSOFTECH PRIVATE LIMITED,Chennai,"1,50,000 - 2,00,000 PA.","BPO, voice, hindi, day shift, domestic bpo, Malayalam, Customer Service, bpo voice",https://www.naukri.com/job-listings-spot-offer-100-openings-domestic-bpo-voice-process-armsoftech-private-limited-chennai-0-to-5-years-020322005241?src=jobsearchDesk&sid=16470887823698630&xp=17&px=36
713,Customer Support,Unibros,Chennai,Not disclosed,"BPO, customer service, voice, inbound, outbound, Voice process, Analytical, Focus",https://www.naukri.com/job-listings-customer-support-unibros-technologies-chennai-0-to-3-years-301118501816?src=jobsearchDesk&sid=16470887823698630&xp=18&px=36
714,"Medical Coding Jobs - Wanted MLT,Operation Theatre Tech,Dialysis Tech",Achievers Spot,"Madurai, Chennai, Coimbatore","3,25,000 - 4,50,000 PA.","Medical Coder Trainee, Medical Coding Jobs, operation theatre technician, medical coding executive, ott, medical coding, Medical Coding Specialist, Junior Medical Coder",https://www.naukri.com/job-listings-medical-coding-jobs-wanted-mlt-operation-theatre-tech-dialysis-tech-achievers-spot-madurai-chennai-coimbatore-0-to-3-years-291020006679?src=jobsearchDesk&sid=16470887823698630&xp=19&px=36
715,Sales Associate,UVA Digital.,"Chennai, Coimbatore, Bangalore/Bengaluru",Not disclosed,Sales Associate,https://www.naukri.com/job-listings-sales-associate-uva-digital-chennai-coimbatore-bangalore-bengaluru-0-to-4-years-280721500685?src=jobsearchDesk&sid=16470887823698630&xp=20&px=36
716,Customer Support,Unibros,Chennai,Not disclosed,"BPO, customer service, voice, inbound, outbound, Building, Voice process, Analytical",https://www.naukri.com/job-listings-customer-support-unibros-technologies-chennai-0-to-3-years-261217500390?src=jobsearchDesk&sid=16470888024713099&xp=1&px=37
717,"Medical Coding Job(fresher Ug/pg) Pharm,lifescience,be(biotech&biomed)",Achievers Spot,"Madurai, Chennai, Coimbatore","3,25,000 - 4,50,000 PA.","Medical Coder Trainee, Medical Coding Jobs, medical coding executive, Life Sciences, medical coding, Medical Coding Specialist, Junior Medical Coder, Medical Coding Analyst",https://www.naukri.com/job-listings-medical-coding-fresher-ug-pg-pharm-lifescience-be-biotech-biomed-achievers-spot-madurai-chennai-coimbatore-0-to-3-years-261119008170?src=jobsearchDesk&sid=16470888024713099&xp=2&px=37
718,"Walk in For ME / M. Tech Fresher - JAVA Developer IT company, Chennai.",JTS Jobs Consultancy,Chennai,"2,00,000 - 3,00,000 PA.","JAVA, IT Skills, Core Java, C++, Software Developer, C, MySQL, Software Engineer",https://www.naukri.com/job-listings-walk-in-for-me-m-tech-fresher-java-developer-it-company-chennai-jts-jobs-consultancy-chennai-0-to-0-years-250222009082?src=jobsearchDesk&sid=16470888024713099&xp=3&px=37
719,Tele Callers (Hindi or Kannada) - Hdfc Sales - Chennai & Bangalore,HDFC Sales,"Chennai, Bangalore/Bengaluru",Not disclosed,"BPO, voice, Call Center Management, HL, Home Loans, Telesales, Voice Process, Outbound Process",https://www.naukri.com/job-listings-tele-callers-hindi-or-kannada-hdfc-sales-chennai-bangalore-hdfc-sales-pvt-ltd-chennai-bangalore-bengaluru-0-to-3-years-230222003328?src=jobsearchDesk&sid=16470888024713099&xp=4&px=37
720,Investor Service Executive,Talent Zone Consultant,Chennai,Not disclosed,"BPO, Voice process, Service Executive, Management",https://www.naukri.com/job-listings-investor-service-executive-talent-zone-consultant-chennai-0-to-1-years-230120501090?src=jobsearchDesk&sid=16470888024713099&xp=5&px=37
721,Customer Experience Associate,Epowerx Learning Technologies Private Limited,Chennai,"3,00,000 - 4,00,000 PA.","Customer Service, business management, Non Voice Process, Solving Queries, Calling, Customer Satisfaction, training, problem solving",https://www.naukri.com/job-listings-customer-experience-associate-epowerx-learning-technologies-private-limited-chennai-0-to-5-years-220222001730?src=jobsearchDesk&sid=16470888024713099&xp=6&px=37
722,Customer Support Executive,Zealous Services,Chennai,Not disclosed,"Voice process, Analytical, Customer Support Executive",https://www.naukri.com/job-listings-customer-support-executive-zealous-services-chennai-0-to-4-years-220120500835?src=jobsearchDesk&sid=16470888024713099&xp=7&px=37
723,Customer Relation Officer- English & Hindi,AA DUKAAN FINANCIAL SERVICES PVT. LTD. (bankbazaa r.com),Chennai,"1,50,000 - 1,75,000 PA.","Customer Relationship, Domestic BPO, Voice Process, BPO, customer service, voice, inbound, telecalling",https://www.naukri.com/job-listings-customer-relation-officer-english-hindi-aa-dukaan-financial-services-pvt-ltd-bankbazaa-r-com-chennai-0-to-5-years-211220004224?src=jobsearchDesk&sid=16470888024713099&xp=8&px=37
724,"Fresher Medical Coding Job For Bsc/msc MLT,Dmlt,Medical Lab Technician",Achievers Spot,"Karur, Perambalur, Chennai","3,25,000 - 4,50,000 PA.","medical coding specialist, trainee medical coder, GNM, medical coding executive, MEDICAL LAB TECHNOLOGY, medical coding, medical coding jobs, Dmlt",https://www.naukri.com/job-listings-fresher-medical-coding-for-bsc-msc-mlt-dmlt-medical-lab-technician-achievers-spot-karur-perambalur-chennai-0-to-3-years-211219004621?src=jobsearchDesk&sid=16470888024713099&xp=9&px=37
725,Customer Relationship Officer - English | Day Shift,BankBazaar,Chennai,"1,75,000 - 2,75,000 PA.","BPO, fresher, voice process, Customer Support, Sales, customer relationship, Domestic Voice Process, International BPO",https://www.naukri.com/job-listings-customer-relationship-officer-english-day-shift-bankbazaar-chennai-0-to-5-years-210222002026?src=jobsearchDesk&sid=16470888024713099&xp=10&px=37
726,Tele Marketing Executive,Xplore Services,Remote,"2,25,000 - 2,50,000 PA.","Outbound Sales, Telesales, Telecalling, Telemarketing, Marketing, Outbound Calling",https://www.naukri.com/job-listings-tele-marketing-executive-xplore-services-chennai-0-to-2-years-201021000391?src=jobsearchDesk&sid=16470888024713099&xp=11&px=37
727,immediate openings For Hindi voice support For Airlines process,ONE POINT ONE SOLUTIONS LIMITED,Chennai,"1,75,000 - 2,00,000 PA.","BPO, voice, inbound, hindi, Customer Service, Direct Sales, Mutual Funds Sales, Voice Process",https://www.naukri.com/job-listings-immediate-openings-for-hindi-voice-support-for-airlines-process-one-point-one-solutions-limited-chennai-0-to-3-years-200222001313?src=jobsearchDesk&sid=16470888024713099&xp=12&px=37
728,"Medical Coding Jobs For Nursing,GNM, Dgnm,ANM,Staff Nurse Freshers/Exp",Achievers Spot,"Rajahmundry, Chennai, Chitoor","3,50,000 - 4,50,000 PA.","ANM, executive medical coder, medical coding specialist, GNM, medical coding executive, STAFF NURSE, medical coding, medical coding jobs",https://www.naukri.com/job-listings-medical-coding-jobs-for-nursing-gnm-dgnm-anm-staff-nurse-freshers-exp-achievers-spot-rajahmundry-chennai-chitoor-0-to-2-years-180919009799?src=jobsearchDesk&sid=16470888024713099&xp=13&px=37
729,Marketing Executive,Spice Web Services,"Madurai, Nagercoil, Chennai, Trichy, Bengaluru",Not disclosed,"Communication, Service Lead, Lead generation, Interpersonal skills, Web technologies, Focus, Customer service, Management",https://www.naukri.com/job-listings-marketing-executive-spice-web-services-madurai-nagercoil-chennai-trichy-bengaluru-bangalore-0-to-3-years-180918500827?src=jobsearchDesk&sid=16470888024713099&xp=14&px=37
730,Tele Marketing Executive,Spice Web Services,"Madurai, Nagercoil, Chennai, Trichy, Bengaluru",Not disclosed,"Communication, Service Lead, Lead generation, Interpersonal skills, Focus, Customer service, Management, Research",https://www.naukri.com/job-listings-tele-marketing-executive-spice-web-services-madurai-nagercoil-chennai-trichy-bengaluru-bangalore-0-to-3-years-180918500826?src=jobsearchDesk&sid=16470888024713099&xp=15&px=37
731,Sales Engineer (On 3rd Party Payroll),Lapp India Private Limited,"Guwahati, Kochi/Cochin, Noida, Chandigarh, Pune, Chennai, Bangalore/Bengaluru, Delhi / NCR","2,75,000 - 5,00,000 PA.","Sales Engineer, Retail Sales, Indoor Sales, Electrical Sales, Sales, Distributor Sales, Freshers",https://www.naukri.com/job-listings-sales-engineer-on-3rd-party-payroll-lapp-india-private-limited-guwahati-kochi-cochin-noida-chandigarh-pune-chennai-bangalore-bengaluru-delhi-ncr-0-to-5-years-180222008898?src=jobsearchDesk&sid=16470888024713099&xp=16&px=37
732,Tele Marketing Executive,Spice Web Services,"Bengaluru, Bengaluru / Bangalore, Chennai, Madurai, Nagercoil, Trichy",Not disclosed,"Communication, web based, relationships, good communication, tele marketing, prospecting, business, building management",https://www.naukri.com/job-listings-tele-marketing-executive-spice-web-services-bengaluru-bangalore-bengaluru-bangalore-chennai-madurai-nagercoil-trichy-0-to-3-years-170715503563?src=jobsearchDesk&sid=16470888024713099&xp=17&px=37
733,Marketing Executive,Spice Web Services,"Bengaluru, Bengaluru / Bangalore, Chennai, Madurai, Nagercoil, Trichy",Not disclosed,"Communication, web based, relationships, good communication, prospecting, business, building management, new business",https://www.naukri.com/job-listings-marketing-executive-spice-web-services-bengaluru-bangalore-bengaluru-bangalore-chennai-madurai-nagercoil-trichy-0-to-3-years-170715503352?src=jobsearchDesk&sid=16470888024713099&xp=18&px=37
734,Business Development Executive (US IT Inside Sales - B2B),Photon,"Chennai(Ramapuram +1), Bangalore/Bengaluru(Bellandur)
(WFH during Covid)","4,25,000 - 5,50,000 PA.","communication, presentation, IT Skills, Software Development, US IT Sales, Lead Generation, Cold Calling, Inside Sales",https://www.naukri.com/job-listings-business-development-executive-us-it-inside-sales-b2b-photon-interactive-pvt-ltd-chennai-bangalore-bengaluru-0-to-5-years-170421000080?src=jobsearchDesk&sid=16470888024713099&xp=19&px=37
735,Customer Support Executive,Konnect Mojo,Chennai,"1,50,000 - 3,50,000 PA.","BPO, hindi, Customer Calling, Telesales, Languages, Voice Process, Tamil, Marketing",https://www.naukri.com/job-listings-customer-support-executive-konnect-mojo-chennai-0-to-4-years-170222007048?src=jobsearchDesk&sid=16470888219123612&xp=1&px=38
